{
  "code": "B057",
  "name": {
    "ru": "Информационные технологии",
    "kz": "Ақпараттық технологиялар",
    "en": "Information Technologies"
  },
  "subjects": [
    {
      "name": {
        "ru": "Математика",
        "kz": "Математика",
        "en": "Mathematics"
      },
      "order": 1
    },
    {
      "name": {
        "ru": "Физика",
        "kz": "Физика",
        "en": "Physics"
      },
      "order": 2
    }
  ],
  "metadata": {
    "source_system": "external-import-service",
    "source_url": "https://example.kz/ent-subjects",
    "collected_at": "2026-03-14T00:00:00Z",
    "schema_version": "1.0.0",
    "notes": "Шаблон для импорта группы образовательных программ и соответствующих профильных предметов ЕНТ."
  }
}
